number,name,status
578,Python Runtime Audit Hook,Accepted
563,Postponed Evaluation of Annotati,Accepted
560,Core support for typing module and generic,Accepted
544,Protocols: Structural subtyping (static duck typing),Accepted
458,Secure PyPI downloads with signed repository metadata,Accepted
723,Inline script metadata,Provisional
708,Extending the Repository API to Mitigate Dependency Confusion Attack,Provisional
8105,2024 Term Steering Council electi,Active
8104,2023 Term Steering Council electi,Active
8103,2022 Term Steering Council electi,Final
8102,2021 Term Steering Council electi,Final
8101,2020 Term Steering Council electi,Final
8100,January 2019 Steering Council electi,Final
8016,The Steering Council Model,Accepted
8000,Python Language Governance Proposal Overview,Final
8002,Open Source Governance Surv,Final
801,Reserved,Active
3333,Python Web Server Gateway Interface v1.0.1,Final
719,Python 3.13 Release Schedul,Active
693,Python 3.12 Release Schedul,Active
619,Python 3.10 Release Schedul,Active
672,Unicode-related Security Considerations for P,Active
664,Python 3.11 Release Schedul,Active
636,Structural Pattern Matching: Tutorial,Final
635,Structural Pattern Matching: Motivation and Rational,Final
596,Python 3.9 Release Schedul,Active
630,Isolating Extension Modul,Final
607,Reducing CPython’s Feature Delivery Latenc,Final
602,Annual Release Cycle for P,Accepted
579,Refactoring C functions and method,Final
569,Python 3.8 Release Schedul,Active
514,Python registration in the Windows regi,Active
483,The Theory of Type Hi,Final
482,Literature Overview for Type Hi,Final
457,Notation For Positional-Only Param,Final
452,API for Cryptographic Hash Functions v2.0,Final
434,IDLE Enhancement Exception for All Branc,Active
430,Migrating to Python 3 as the default online documentati,Final
399,Pure Python/C Accelerator Module Compatibility Requirem,Final
394,The “python” Command on Unix-Like System,Active
333,Python Web Server Gateway Interface v1.0,Final
291,Backward Compatibility for the Python 2 Standard Libra,Final
290,Code Migration and Modernizati,Active
287,reStructuredText Docstring Forma,Active
272,API for Block Encryption Algorithms v1.0,Final
257,Docstring Conventi,Active
249,Python Database API Specification v2.0,Final
248,Python Database API Specification v1.0,Final
247,API for Cryptographic Hash Functi,Final
101,Doing Python Releases 101,Active
20,The Zen of P,Active
732,The Python Documentation Editorial Board,Active
731,C API Working Group Cha,Active
729,Typing governance proc,Active
676,PEP Infrastructure Proc,Active
581,Using GitHub Issues for CP,Accepted
609,Python Packaging Authority (PyPA) Governanc,Active
387,Backwards Compatibility Polic,Active
13,Python Language Governanc,Active
12,Sample reStructuredText PEP Templa,Active
11,CPython platform su,Active
10,Voting Guideli,Active
8,Style Guide for Python Cod,Active
7,Style Guide for C Cod,Active
4,Deprecation of Standard Modul,Active
2,Procedure for Adding New Modul,Active
